row_idx,topic_id,topic_prob,place_name,rating,review_text,publish_time
1894,0.0,0.5543119311332703,Salpoente,5,Fantastic dinner in a stunningly renovated warehouse. We were greeted with a glass of cava. The staff and sommelier were very attentive and expertly timed each course. The smoked eel and beetroot was phenomenal and the veal was done to perfection. Dessert was out of this world. I would highly recommend! 😊,2024-10-14T23:46:54.552970Z
1895,0.0,0.5241580605506897,Salpoente,3,"Nice restaurant but a bit overpriced the full experience. Totally for tourists.
The service is really not good for being the “best restaurant in town”.
The food was good, and that’s it. 50 euros per person without alcohol drinks, and sharing starters.",2024-10-08T16:46:29.672261Z
1896,1.0,0.584219753742218,Academia R&D,5,"It's the best dancing school! Welcoming environment, with rythm and creativity everywhere!!
Highly recommend!",2024-12-17T20:42:04.349740Z
1897,4.0,0.47221651673316956,Hotel Barra,1,"I wanted to put a minus one star but there is no option for that...we stayed at this hotel last March....actually I could not stay here...it was too nasty...too filthy, it was old, dusty, smelled horrible....I told my husband I would be sleeping in the car...he got us a much nicer room at a lovely little hotel around the corner...this hotel ( Hotel Barra) should be torn down and a new one built...",2020-09-11T00:03:06.912006Z
1898,4.0,0.8986411094665527,Hotel Barra,4,Very friendly..breakfast was great and view from breakfast area was beautiful,2019-05-13T10:43:26.830743Z
1899,3.0,0.8388468027114868,Hotel Barra,1,Horrible hotel! Old and Dirty!,2018-07-21T12:49:45.071Z
1900,2.0,0.5999427437782288,Hotel Barra,4,Cheap and cheerful,2022-01-30T18:49:00.319973Z
1901,3.0,0.7305976152420044,Hotel Barra,2,it is at the moment closed,2021-08-10T08:11:12.351758Z
1902,2.0,0.7289044857025146,World of Utilities,5,Very good service,2020-12-15T13:03:52.646679Z
1903,3.0,0.7292616963386536,Paradero bus aveiro,1,"No description, the name of the station is not displayed and there is no timetable.",2022-11-09T17:34:59.745971Z
1904,1.0,0.5998979210853577,Beach House,5,Top,2021-08-25T08:14:01.915860Z
1905,3.0,0.8846978545188904,Beach House,1,"Very unpleasant, even from the first phone call. We ran away. Do the same.",2023-05-08T00:44:49.220647Z
1906,3.0,0.632964551448822,Banco Montepio | Ílhavo - Barra,1,"I'm very disappointed with my last visit on October 12, 2021, to activate a credit card. The staff at the Praia da Barra branch were unfortunately very arrogant and incompetent, lacking the social skills or training to properly answer a simple question. We were practically thrown out of the branch without our request being resolved.

The manager was also present and overheard the situation, but his arrogance and incompetence were equally evident. Let's see if he gets in touch now...",2021-10-16T21:01:05.519038Z
1907,0.0,0.7308229804039001,Banco Montepio | Ílhavo - Barra,5,Excellent and attentive,2023-09-09T20:58:29.142765Z
1908,4.0,0.6328298449516296,Korall - Home Style,4,"Lots of unusual items and good clothes.
The owner sells well.",2019-08-29T17:53:46.754932Z
1909,2.0,0.9239310026168823,Cufra Aveiro,5,"Great lunch with coworkers! I wanted to try this ""Francesinha""long ago, and it turns out to be fantastic! The atmosphere and the waiters were nice and helpful! I ordered the special one and it was very tasty. The fries were great too!",2025-10-27T13:37:01.778863944Z
1910,2.0,0.40294820070266724,Cufra Aveiro,4,"""Francesinha"" was the dish we tried, a decent sauce and tender steak,was a pleasant surprise. Restaurante was  clean and calm. Service was attentive and helpful,overall a good experience.",2025-04-21T08:59:30.842947Z
1911,3.0,0.6448751091957092,Cufra Aveiro,3,"Food is ok, service is horrid, takes forever and they keep forgetting things, the waiters kept forgetting to bring the fries they should have, despite 2 different employees having been reminded to do so, we left without those fries as the meal was over before they came. In the meantime, services for eating out like glovo and uber eats kept picking up their orders without any issues as they were given priority over seating patrons. Room felt cramped, people in smaller groups or without brazillian patrons were neglected and made tired expressions about it.
Just order it online if you're curious, the food was the only nice thing out of the experience and they won't be able to ""bring your fries later"", so you'll get your damn fries.",2025-08-24T02:17:17.473517419Z
1912,0.0,0.8370862007141113,Cufra Aveiro,5,"My first Francesina, very tasty! Friendly staff.
Recomended!",2024-03-08T16:10:58.990661Z
1913,0.0,0.8830288052558899,Cufra Aveiro,3,The food was okeish. I was expecting a lot better. Service was good,2024-02-07T14:18:59.461299Z
1914,2.0,0.7803325653076172,Iris,4,"Good place to stop for lunch after visiting the Praia de Gafanha. Tasty hamburgers and fries, and the staff made 2 very good improvised vegetarian sandwiches for the ones in our party that didn’t want to eat meat.

Communicating in English with the waiter was a little hard but, he made it work. Would definitely recommend!",2022-07-05T18:26:10.168051Z
1915,2.0,0.6369913816452026,Iris,5,"Place with very nice English-speaking staff. Delicious pastries, bifanas and excellent coffee. Very affordable.",2024-01-04T12:11:38.960082Z
1916,0.0,0.6164385676383972,Iris,5,"One of the best pizzas I have tried in my life (very juicy and tasty), the fries are great too.",2019-06-21T23:40:38.918380Z
1917,3.0,0.6856876611709595,Iris,1,"I have been living in Portugal for two years and working in the service sector 14 years.
I lived by the ocean for half a year and visited this cafe almost every day.
This should not happen and I leave one star for the terrible service and the raised tone of the woman who apparently is the manager there.
I arrived on an electric scooter, plugged it in and ordered coffee.
There was not a single sign that I could not do this or that this service was paid.
I wanted to charge it a little while I had some coffee.
Moreover, I had already done this in other cafes in the area and no one allowed themselves to behave like that with me.
And what’s more, I don’t behave with my clients and they can always charge their phone or scooter when they relax with us.
When I finished my coffee and started reading the newspaper, a waiter boy came up to me and said that I was wasting a lot of their electricity, and this woman immediately ran up and shooed me away in a rude tone and said that I should have asked permission first and that it was expensive.
When I asked how much and where the indicator about the amount weighed, she ran away.
Seriously? A lot of?
An electric scooter will eat as much as a mobile phone in 10 minutes.
I have Portuguese friends and clients and I would not recommend this place to anyone.
It's a shame that such a service is in a place where there are now a lot of tourists and locals.",2024-06-09T18:00:16.018279Z
1918,2.0,0.7112740278244019,Iris,5,"We tried two other cafes before this and it's definitely the best! Good bread, cakes and coffee. Really busy on a Sunday full of locals.",2024-10-07T17:45:21.396299Z
1919,0.0,0.9491548538208008,Nova Barra,5,Fantastic place to eat and wonderful service. I'm here on vacation and it is the place to be! The atmosphere is amazing and the food is even better. I will definitely be coming back.,2025-07-15T00:02:01.620700788Z
1920,0.0,0.6634112000465393,Nova Barra,5,I visited here on vacation.  The food was excellent and there was a great array of choices.  Service was fast and we were able to get in and out and back to the beach quickly.  Highly recommend!,2025-06-04T19:16:10.304462Z
1921,0.0,0.8982404470443726,Nova Barra,5,"Would recommended the vegetarian francesinha from here, it’s amazing. The staff are so lovely too",2025-10-13T19:25:11.920478521Z
1922,0.0,0.8368930220603943,Nova Barra,5,Food was great and such fun service!,2025-10-10T19:44:09.805154779Z
1923,0.0,0.6157308220863342,Nova Barra,1,"It's horrible. I've been there twice, for pizza, and I had to wait more than 45 minutes, and the fist time the pizza wasn't even in the oven after 30min. They prioritize the pizzas to go, and the oven must be only for 2 pizzas at the time.",2022-08-01T19:54:17.907240Z
1924,0.0,0.8840209245681763,Iracema bolos regionais,4,Cute spot to try waffle type of treats.,2025-06-21T19:14:52.658911008Z
1925,0.0,0.8983599543571472,Iracema bolos regionais,5,The best “tripas” and a fantastic atmosphere with lovely ladies! I highly recommend!,2025-08-08T14:34:19.850508776Z
1926,1.0,0.4703103303909302,Iracema bolos regionais,5,"You have to try it, it is must do in this area! Cream one is the best.",2021-11-12T22:48:53.851603Z
1927,0.0,0.898643434047699,Iracema bolos regionais,5,"What a lovely place, lady is super friendly and everything is delicious ❤️",2021-10-09T15:30:13.400172Z
1928,4.0,0.5056330561637878,Iracema bolos regionais,5,Best in the area great workers good quality . Always go here when I'm in the area .,2017-08-26T21:11:10.234Z
1929,2.0,0.6275643706321716,Faros Gourmet,3,"Nice place, Right next to the canal.
Very friendly service. Price is okay.
Recommended food: shrimps, gizzard, coriander pork feet, clams (all very yummy)
Stuffed cuttlefish is so so.
Not so good: mussels(not so fresh), oysters(not so fresh), sangria red (way too sweet).
Remember to check the bill amount before paying.",2021-09-23T16:50:51.853515Z
1930,0.0,0.37657660245895386,Faros Gourmet,4,"Resturant has high reviews & its well deserved
Its located by the canal so nice outdoor seating . The resutrant is small so might need to waite. Staff are very friendly and attentive they try there best to explain the dishes.
They have kids meal ( fish / chicken fingers )
My favoutite is the stuffed octopus risotto
Everyghing tasted yummy and sardines too . My least is the floerless chocolat cake it was very eggy .",2023-08-01T21:09:50.225001Z
1931,2.0,0.7558140754699707,Faros Gourmet,5,They just rebuild from what we saw. Really well done nice place. Food wines and service been great. Price / quality value supreme.,2024-04-14T16:56:42.670434Z
1932,2.0,0.6541205048561096,Faros Gourmet,3,"Nice little restaurant.
It is not in Aveiro, but near the beach.
Nothing too special
Do not confuse it with one with high recommendations and it is not exactly gourmet.
Also there are no oysters served here, even though someone posted photos of it.",2025-09-09T19:19:01.821263750Z
1933,2.0,0.9606727957725525,Faros Gourmet,5,"Great seafood. Very neatly preapared and simple served. Two factors that make this place worth visiting. We’ve tried stuffed squid, oysters, grilled sardines, fried mix - no complaints at all. Prices are right too and service is kind. Highly recommended.",2022-08-24T08:07:47.058272Z
1934,0.0,0.5916117429733276,Gelato Davvero Barra Beach,4,This is a very famous ice cream shop in Portugal. My Portuguese friends took me here. It's a small shop with many flavors to choose from. Ice cream lovers shouldn't miss it. The price is not expensive and the ice cream is rich and flavorful.,2025-10-12T13:30:13.511804989Z
1935,1.0,0.4857196807861328,Gelato Davvero Barra Beach,5,"Definitely top of the line Gelato, well worth coming over from Aveiro where we were staying.  I’ve tasted Gelato wherever I have a chance in Europe.  Always comparing to my favorite places in Italy and this ranks right up there with the best.  They use local ingredients when possible, make all their own flavors.  I went overboard after the first cone with my standard taste test of chocolate and berry, they hit a home run, as they say.  Then I turned around and tried a cinnamon and basil, was fantastic.  Then the owner brought me freshly made marscapone for a taste test, it was way over the top. The creamiest I’ve ever had!",2025-11-11T16:46:48.387210258Z
1936,0.0,0.4866052567958832,Gelato Davvero Barra Beach,5,"The best Italian ice cream out of Italy 🇮🇹
I’ve ever had! Delicious, creamy and full of flavours!
You can see the process of the making from natural ingredients through the window.
Amazing owners and easy going ambience, dogs friendly. TOP 🍦",2024-06-02T15:45:10.882665Z
1937,0.0,0.6551576852798462,Gelato Davvero Barra Beach,5,"2 euro for 2 flavors in a bowl of the best ice cream I’ve ever had, spectacular value and quality  , we came every day we were staying in Praia da Barra.",2025-08-21T16:33:06.236979983Z
1938,1.0,0.47161024808883667,Gelato Davvero Barra Beach,5,"Very nice place, enough space inside the care. Good selection of tastes. Pistachio and salted caramel are top. Avocado taste is very interesting, but not my thing). The prices for the gelato are the lowest I’ve seen in Europe this year",2023-07-27T17:24:56.300557Z
1939,1.0,0.4691421091556549,Gelataria A.T. Milano Barra,5,"Best banana split ever:
It's 4 scoops that you can choose by your own and only costs 7,5€. The stuff was also very nice! Can totally recommend",2022-07-09T17:05:42.451434Z
1940,0.0,0.9183852076530457,Gelataria A.T. Milano Barra,5,Excellent and tasty french crepe(thin and light pancake) with ice cream and egg licorice. Delicious 😋,2023-10-17T00:03:18.412509Z
1941,4.0,0.450549453496933,Gelataria A.T. Milano Barra,5,"The best icecream shop in Barra. The icecream is soft, full of flavor and they have a lot of options for us. The attention is great. You have coffee and waffles or crepes for breakfast or an amazing giant icecream for dessert. Open from really early in the morning, till midnight in summer and it's on the way of the beach, less than 2 blocks to touch the sea with your toes.",2022-07-19T08:15:44.622553Z
1942,0.0,0.8835546374320984,Gelataria A.T. Milano Barra,5,"Wonderful ice-cream. Wonderful humans, XXX thanks so much for returning my mobile XXX",2019-06-12T23:42:25.085677Z
1943,2.0,0.6171722412109375,Gelataria A.T. Milano Barra,4,"Very nice place to go with friends.
Good ice-cream, creamy, but some of then don't taste like described.
Nice staff.
This place near/front way to the beach.
Have parking lot near.",2022-07-22T23:55:19.642999Z
1944,0.0,0.9572137594223022,Gama,5,First time at Gama and loved it! Great food and great space! Had the taco and it was delicious!!! Will definitely go back for a Francesinha :) Would definitely recommend it!!! Marina and Gabriel were wonderful too! Super helpful and knowledgeable! :D,2025-08-31T13:54:39.785399923Z
1945,2.0,0.4047106206417084,Gama,5,"I am really surprised about the beautiful location! You feel very welcome and the food was delicious (i am from Germany, I know a good kebab^^)!
We are excited to come more often in the future, thank you!",2025-05-31T14:27:53.412261Z
1946,2.0,0.7427797317504883,Gama,5,I ate Tortilla Wrap.It was so Delicious and Fresh vegetables.Nice place to eat and chill near the beach.Friendly Staff.I highly recommend.,2025-07-01T19:42:55.711642424Z
1947,0.0,0.7424134612083435,Gama,5,"One of the best restaurants I've ever been to, the food is great, the atmosphere is super inviting, and the people running the place are very friendly, simply fantastic!",2025-05-08T18:57:26.262190Z
1948,2.0,0.7704892754554749,Gama,5,"Really loved this place, nice terrace, good food and the staff was really friendly and nice.",2025-07-08T13:33:42.506524398Z
1949,3.0,0.3694687485694885,Esplanada Zé Manel,5,"Very nice place to enjoy the beach and the sun. Near from the sand and ocean. Quiet, friendly and clear. The staff are friendly and respectful. Payment suggestions with money, since need minimum 10e to pay with card. On the side you a ice-cream shop from same company. Car parking don't have, since near from beach, you need to search around, some times it's hard to find one.",2023-07-13T18:06:24.149568Z
1950,0.0,0.5048003792762756,Esplanada Zé Manel,5,Food never disappoints. Their clams in garlic sauce are probably the best I've had. Service is great and it's one place you don't have to worry about closing for lunch. Their house wine is great. Their Bream fish amazing. Definitely a place to stop by and enjoy some great food while enjoying the beautiful sea view.,2022-08-01T16:42:35.033293Z
1951,2.0,0.4717985689640045,Esplanada Zé Manel,3,"Decent little spot just off the beach. With transparent windbreak so you can see the sunset. Fairly inexpensive for a beach beer, but they said they couldn't take card when we were there. Friendly enough staff.",2020-07-30T12:42:11.569285Z
1952,0.0,0.4729427397251129,Esplanada Zé Manel,3,If want to experience you should go. Food similar to other places around.,2018-07-26T20:39:07.737Z
1953,2.0,0.5523178577423096,Restaurante Barra Mar,5,"BEST PREGO NO PAO EVER!!! And also the clams are very good. This restaurant is nice to sit down and have a nice beer. I really do like the restaurant but for ice cream. It’s not the best place to go to. They’re soft ice cream is very good but I can go to another place for cheaper, I understand because it’s by the water but if you take a walk down to the main road, you’ll find another place with cheaper ice cream, but the food is top-notch. It has a nice buffet inside although I’ve never had it. The food looks very good. The Prego no pao is top notch is the best sandwich I have ever had in this beach, the bread soaked up all the juices and makes it 10 times better than meat is good as well but last time I went I had a nerve which ruined it a little bit but still made it very good That’s why I gave this five stars.",2025-08-20T12:32:32.147928013Z
1954,2.0,0.7172055840492249,Restaurante Barra Mar,5,Had my favourite meal in Portugal here. Was advised to get the robalo and greatly enjoyed it! It overlooks the beach and is a great spot to break for lunch!,2023-08-21T00:22:49.845696Z
1955,2.0,0.95222407579422,Restaurante Barra Mar,5,"It was very tasty squid! Portions are big! But the taste was amazing! Like it a lot! Service is really great, very friendly waiters! Suggest to go there to have tasty lunch or refresh Yourself with wine or beer! :)",2023-06-26T15:33:37.315354Z
1956,1.0,0.3875879645347595,Restaurante Barra Mar,1,Really horrible. Maybe the worst Restaurant I have Ever been to!,2025-08-18T20:43:30.525168673Z
1957,3.0,0.8622117638587952,Restaurante Barra Mar,1,Really can't recommend. Better go anywhere else,2025-08-18T20:18:34.135214821Z
1958,2.0,0.5970596671104431,Loja das Gangas,3,Choice,2016-07-08T19:39:25.474Z
1959,3.0,0.5039809942245483,Stay in Aveiro,1,"The worst experience ever I had to leave the hostel immediately..
The room was not clean and had a strong smell of mold, and the bathroom was also unclean with no soap provided for handwashing.
When I contacted the staff through WhatsApp to request an extra blanket and inquire about the possibility of changing rooms due to the poor hygiene conditions, I was shocked by the response. I was told that because I chose the cheapest room, I should expect a lack of cleanliness, which is an unacceptable way to address customer concerns.Furthermore, I was accused of being a liar when I mentioned the hygiene issues. This level of unprofessionalism and lack of customer service is unacceptable.",2024-09-02T10:08:14.066659Z
1960,4.0,0.5044316649436951,Stay in Aveiro,5,"It's a low-budget hostel. I think it's perfect for a couple of nights. We staid here 1 night and we were afraid it might be loud. It was surprisingly quiet despite a couple, across the hallway, deciding they want to have a very loud conversation. We could hear them, but I would say the doors did a great job keeping their volume low.
The bathrooms are fine, and while not perfect, they had everything. And I should add there were 3 bathrooms, which is great.
Unfortunately, the kitchen is only a microwave and don't expect to have any space in the fridge (it's tiny). No plates, or forks/knives, But there are a ton of cheap food places in the area.
Lastly, the is no reception. I liked it, since our key was in a secured box, and this meant we could have arrived at any hour, which was good :D",2022-07-18T09:02:19.480232Z
1961,4.0,0.6110367774963379,Stay in Aveiro,1,"Horrible, just don't come to this place you will save yourself from an unpleasant experience.
The bedroom just stinks and the photos give you an ilusion of how the things really are.
It is a very old house, cold and dirty even the bed isn't properly cleaned and I really doubt that this room had any cleaning at all, not to mention that one of the windows is broken and only one of them opens.
Not worth the value, even for free I wouldn't come to this place again...",2023-01-08T13:52:48.776483Z
1962,4.0,0.6714046597480774,Stay in Aveiro,1,"2 nights for 225 euros. Total rip off! Right price would have been around 30-40 euros per night. 2.5 times 2.5m room with bunk bed, light, table and a chair. S###. Toilets/showers shared, same with fridge. My recommendation is don't go there. I stayed one night, another night would have been too much.",2022-08-15T20:40:26.140509Z
1963,4.0,0.6245965361595154,Stay in Aveiro,4,For a lowbudget hostel this one is very good and I would definitely recommend! You can’t really expect more than that for this price. It may could be a bit more clean and the shower could be covered so that the water does not spread all over the bathroom,2021-09-14T12:52:08.189673Z
1964,1.0,0.8360210657119751,"(MAYAL) Irmãos Maias, Lda.",5,"I had a flat tire on my stroller, and Mr. Jorge was very kind. He fixed the tire and saved our trip to Aveiro. Thanks, Jorge!!!",2022-04-12T20:07:05.900891Z
1965,2.0,0.5328602194786072,Casa Olga,5,"A hidden place next to train station where you can have a good food with a very nice price.
Super traditional place, with the daily options per 8 euros (Including bread, wine, coffee and dessert).
Keep in mind they don't accept card.",2022-04-12T06:16:32.053373Z
1966,2.0,0.6868153810501099,Casa Olga,5,"This place is legit. Serves a wonderful Leitão. I ordered a glass of wine and she puts a bottle on the table, respect.",2024-08-16T17:37:39.700262Z
1967,2.0,0.5483563542366028,Casa Olga,5,"It is a local restaurant near the train station. I had pumpkin soup, and it was delicious!",2024-09-22T17:44:46.629017Z
1968,3.0,0.4087925851345062,Casa Olga,5,"If you are looking for real Portuguese experience — that's a place to go. Be ready to step out of your comfort zone — no English here, authentic vibe that might be unusual, and simple dishes",2021-12-05T02:01:54.375635Z
1969,2.0,0.5222838521003723,Casa Olga,5,"Had a lovely meal of suckling pig, potato's and tomato salad. A real neighbourhood cafe off the main route. The lady cooks and serves the food. Very friendly and helpful. Would recommend.",2024-09-08T09:42:56.674635Z
1970,1.0,0.8352500796318054,Aventuresca,5,"Delighted with the welcome, comfort and cleanliness. I recommend.",2021-09-24T06:45:38.542650Z
1971,4.0,0.47837886214256287,Aventuresca,5,"Fast service
Very good egg mollusks
Top-notch, free parking nearby",2016-08-14T22:30:46.370Z
1972,0.0,0.9685425758361816,Relógios de Corda,5,"Very knowledgeable, friendly, and attentive service to go along with an impressive collection of vintage watches. This is a hidden gem in Aveiro, if you love vintage timepieces then make sure to reach out to the shop owner to schedule a visit. They operate by appointment only but are well worth making time for, even if just to stop by for a quick chat.",2024-09-05T03:13:48.693257Z
1973,2.0,0.4869860112667084,Relógios de Corda,5,Great buy and seller !,2024-09-13T12:11:29.334338Z
1974,0.0,0.54653000831604,Onda Flor Sul,5,Really delicious cafe on Praia de Barra. Would recommend a tosta mista on a croissant ! The staff are patient and helpful :) This is my favourite cafe on the beach.,2023-08-21T01:49:07.022004Z
1975,2.0,0.635454535484314,Onda Flor Sul,3,"Nice staff, nice pastries.   Pizza is poor quality.  Pre-made base  and lots of  cheap cheese.",2025-08-05T18:04:58.304030347Z
1976,2.0,0.5277166962623596,Onda Flor Sul,1,"This was the worst service and food I’ve experienced in a long time. We waited over an hour for our food, and after 30 minutes, we had to remind them to bring our drinks. When the food finally arrived, mine was dry and cold, while both of my friends received the wrong orders. One had to settle for the wrong order , a Francesinha that was shockingly bad, and the other had to wait an additional 10 minutes for the correct dish. To top it off, they had run out of fries.
Although they apologized and gave us a small discount by not charging for the drinks — it was only a bottle of water and a small beer—hardly enough to make up for the terrible experience. Absolutely ridiculous.",2025-04-02T07:38:00.100231Z
1977,4.0,0.48852139711380005,Onda Flor Sul,2,"The food is ok, but allowing people to smoke in a enclosed outside space is unnaceptable.",2025-08-06T12:06:05.911146763Z
1978,2.0,0.8448756337165833,Onda Flor Sul,5,"Very good bakery with friendly staff. Best bread rolls in Barra, great dish of the day offers with soup, drink and coffee included, delicious pastries and cakes. Affordable and of top quality. The staff is always helpful and the service is quick. You can dine-in or sit in a glass-house beer garden, you can also order for take-away, the food is packed nicely.",2024-03-19T22:59:00.822611Z
1979,4.0,0.5561652183532715,Lanidor Woman,4,Great store and always with very nice clothes,2022-11-05T08:19:57.301313Z
1980,1.0,0.5972030758857727,Pote de Mel,5,"This is THE surf shop in barra (I think it may be the first? Not sure). The owner & staff speak English. They always have pieces from the new seasons. We buy all our wetsuits, sandals, hats, surf screen and swim wear here. They have all the popular surf brands too. I always get my friends gifts from here as well. And they always have promotions going on!",2022-08-09T09:44:50.739201Z
