row_idx,topic_id,topic_prob,place_name,rating,review_text,publish_time
0,1.0,0.5814894437789917,bp,5,The bp pulse electric charging service is the best in Portugal.,2025-09-27T16:58:47.550011018Z
1,3.0,0.45989957451820374,bp,1,"Normal rated fuel sold under a premium brand, that gives you no benefits. Want your car to work fine do the schedule maintenance in time or within the kms.
Plenty of cheaper fuel stations that sell certified fuel. Waste of money on placebo premium fuel. Anyone saying other wise is either being paid or just a bad mechanic",2020-01-24T03:27:20.917107Z
2,2.0,0.8293737769126892,bp,4,They sell fossil fuels and candy. Nice staff though.,2018-11-16T19:36:19.115422Z
3,1.0,0.4684707224369049,bp,4,"GPL a bit expensive, but at least it's always open",2019-03-29T18:59:22.923429Z
4,2.0,0.3947487771511078,Café BP Maia,5,"Very friendly host.
He didn't speak English, but we were able to communicate with him using gestures.
Nice little café.",2022-09-21T08:28:41.145227Z
5,0.0,0.729328989982605,Café BP Maia,4,Great service.,2025-01-03T00:10:54.199225Z
6,0.0,0.9074324369430542,Melatte Cafe,5,"It's a very nice cafe with excellent service 👌 the staff are wonderful, I recommend it without hesitation.",2021-11-14T00:19:45.836056Z
7,0.0,0.42318832874298096,Brigs,5,"Great authentic places to have a wonderful time. We took Capuccino and double espresso long shot, chicken and cheese Coxinha de frango. It worth to try. There is a great advantage of the place if you are visiting the city with kind. There is perfectly protected kids playground just next to the cafe, so you can enjoy your coffee time and let your kids to enjoy themselves, too.",2022-06-27T12:03:25.251276Z
8,2.0,0.6629559397697449,Brigs,5,"So happy that we found this place for an afternoon coffee break. First of all, it'd hard to find cafes offering soymilk in Portugal so I'm glad Brigs offers it. Friendly service, great coffee and unique sweets! We tried their version of ovos moles and another one filled with caramel textured. Both good! And good value. Highly recommend!",2019-07-01T21:28:10.221546Z
9,4.0,0.547011137008667,Brigs,5,"Very cozy and pleasant place with inspiring view and convenient for children. It offers nice coffee delicacies, petiscos, brigadeiros, pastéis and many other sweet and solty delights!",2017-11-01T12:03:42.131Z
10,2.0,0.6604105830192566,Brigs,5,"Nice little shop right by the Forum. Staff was super nice and helpful with suggestions. You must try the hot chocolate, so thick you can eat it with a spoon and absolutely delicious!",2019-07-31T18:33:11.115330Z
11,2.0,0.569460391998291,Brigs,5,Great outdoor seating. Great service. A good place to sit down and relax if you need a break.,2023-11-23T20:45:24.330052Z
12,2.0,0.5937498807907104,CTT Correios,4,"Very attentive and friendly staff, although a little slow. They are very helpful..! The place is a little dark and with only 3 seats to wait. The seats are very low for an elderly, disabled and/or pregnant person. I don't know how easily a person in a wheelchair could move around the premises.",2019-01-04T11:56:10.877374731Z
13,3.0,0.38782984018325806,CTT Correios,1,"Terrible customer service, unpleasant treatment. They make any business in this center tedious.",2025-04-03T14:50:38.008702Z
14,3.0,0.9489001631736755,bp,1,At night i am going bp and i am waiting 10 minutes front billing services but lady not come and after that  i ring the bell for please come but young lady very disrespectful and       Rudely speak with me she work night shift 👎🏻,2024-05-22T23:47:25.169506Z
15,2.0,0.6318492889404297,Porta 36,5,"It is in the center and the right next to my hotel , the waiter was very nice and welcoming , the food did not take long and it was really nice .
The octopus salad was really good , and the shrimp was delicious as well , the only comment i have is that the shrimp was not deveined and i had to clean it. But otherwise , satisfied with the service and the quality. Would visit again.",2025-10-23T21:24:09.473562163Z
16,2.0,0.6387633085250854,Porta 36,5,Possibly the best steak with cream mushroom sauce I have ever had. Service was exceptional. Great location. My friends had the vegetaruan pasta and the seafood mix with shrimp. They all raved about the experience.,2025-08-30T13:26:17.427979522Z
17,2.0,0.33409634232521057,Porta 36,4,"While passing through Aveiro, we thought we'd grab something to eat. After a short walk through the city streets, we found this restaurant where we decided to stop for a bite to eat.We didn't have high expectations but we were pleasantly surprised ordering something basic from their menu of the day. Overall it was very tasty and cheap, worth trying if you're in a hurry and you don't have enough time to explore the city in search of the perfect restaurant",2024-12-19T22:45:47.015261Z
18,2.0,0.5838801860809326,Porta 36,2,"Food was not good. Stale chips, beef very undercooked(asked for medium rare got barely rare)

Waitress and waiter were very nice but very understaffed and took a long time.

Very overpriced when comparing quality of food and drinks to similar restaurants in the city.

Postive note: cool patio and had heaters for a chillier than usual night.",2025-09-24T21:41:20.272741814Z
19,2.0,0.7083149552345276,Porta 36,5,"We had lunch here and chose the daily special.  I had the cod casserole-type dish, cod with cream, and my husband had the duck rice.  Both meals were delicious and the special included bread, two glasses of wine.  We also ordered dessert and my husband had an espresso.  All included it was less than €30.  Great deal!  Service was friendly and efficient.  Highly recommend!",2022-09-27T19:58:24.188009Z
20,0.0,0.7400029301643372,Ostras da Praça,5,"Everything was so delicious and fresh. Im not the biggest fan of mussels, but id eat this one again no problem. I already miss the food.",2025-11-04T22:20:59.579030957Z
21,2.0,0.8711620569229126,Ostras da Praça,5,Very good place to eat fresh sea food ! Ver good service and a pretty nice quality price. Good wine. Card payment was not possible the day we were there.,2025-10-22T14:46:54.423908639Z
22,2.0,0.7861735224723816,Ostras da Praça,3,"The Croquette de carne was so hard to eat, way too expensive for something local. they fried it way too long. It didn‘t taste good, i had to flush it with the San Miguel beer.",2025-05-16T14:26:36.695397Z
23,3.0,0.4695444107055664,Ostras da Praça,2,"We stopped here for the oysters.
Food (mussels and oysters) were very good and fresh.
Service, one of the worse ever met.
We waited 50 minutes to have 3 oysters (and 35 for the mussels), we repeated 3 times that we were waiting for the oysters and after ""yes yes, immediately ""and 50 minutes, we had them (very good and fresh). Moreover, when we asked the bill they brought the wrong table, and then at the end they told that is ONLY CASH, no credit card. So pay attention Especially for the bad bad service.",2025-08-09T14:10:36.118401246Z
24,0.0,0.7980710864067078,Ostras da Praça,5,The oysters and clams were very delicious!,2025-10-24T15:48:42.064894950Z
25,3.0,0.5893993973731995,"Salicornia - Comer, Beber & Viver",5,We stopped here for a quick bite to eat on the patio after our moliceiro boat tour. We got the ham and cheese sandwich and it was exactly what we needed to finish our quick day trip here in aveiro. Thank you,2025-09-25T13:35:08.853087521Z
26,2.0,0.4663456082344055,"Salicornia - Comer, Beber & Viver",5,We had an amazing time! Pedro was so kind and let us take our time asking questions about the drinks and food. We had a delicious cheese and meat board and enjoyed our refreshing drinks! Pedro is passionate about what he does and gave us personal recommendations!,2025-07-21T13:10:42.111156466Z
27,2.0,0.47788044810295105,"Salicornia - Comer, Beber & Viver",5,We had a great time at Salicornia! The bartenders were amazing and accommodating of our group. The drinks tasted great the accommodations had the perfect atmosphere for enjoying beer and drinks in the afternoon/evening.,2025-04-12T18:24:01.306068Z
28,2.0,0.6067980527877808,"Salicornia - Comer, Beber & Viver",5,Great place with friendly bartenders. We came as a large group and they were accomodating. Only took cash while we were there. Stayed there for a bit and they gave us a shot free of charge.,2025-04-12T18:27:24.938200Z
29,3.0,0.3724108040332794,"Salicornia - Comer, Beber & Viver",5,"Absolute must if you are in Aveiro!
We came to try the local seaweed beer but we're out of season, instead got to try the local seaweed raw, learnt more about the town than any tour guide could tell us and we're in the most wonderful setting! An absolute must tavern! Staff were brilliant, thank you for hosting us",2024-06-12T19:16:19.992277Z
30,3.0,0.46977317333221436,O Tripas,2,"The waitresses were really weird. When we sat down they told us to stand up so they can prep the table. After 10 minutes we said that instead of 22 people tables we actually want 12 people and they said that they close now (we were not informed beforehand, it was 15:30 and it supposedly closed at 15:30 but it was full) and they prepped the table just for us and they are making an exception. Anyway we all sat down (22ppl) since we did not have time to go somewhere else. I was in a table of 7 and we had ordered a salad and since we had ordered 7 dishes (including a salad) they thought we were done and almost left. They also said that their steak is like a happy meal (???). Most of the waiters did not know English so it was hard to communicate.",2024-08-16T15:10:40.639630Z
31,3.0,0.43757912516593933,O Tripas,1,Group of four waiting almost 20 minutes for tables to be cleared after a waiter told us his „friend“ would do it. We sat down and all waiters ignored us. After we got up the table got cleaned almost instantly. Seems they don’t want to make money.,2023-06-10T13:23:21.761034Z
32,3.0,0.5316780805587769,O Tripas,1,"During covid.... don’t even think about it! If you’re not a Portuguese citizen (1) and don’t have a vaccine certificate done in Portugal (2) they WILL NOT accept you eating at their restaurant. Their customer service was appalling. You try have a reasonable conversation about how your antigen test is valid and they walk away from the conversation then come after you, calling you mad! Glad we did not contribute to their soon-to-fail business! If I could give negative stars I would.",2021-08-15T12:50:37.693001Z
33,0.0,0.5899419188499451,O Tripas,2,"Meat undercooked, and a funnily tasting fish soup.. Chips were Home made though.",2018-09-19T22:02:51.870191Z
34,0.0,0.5516396760940552,Garden Hostel,5,I simply loved it. Best value for money I found in Aveiro.,2025-07-13T15:31:19.697171341Z
35,4.0,0.49671676754951477,Garden Hostel,1,"It's a forty minutes walk away (3km) from Aveiro, everything stinks and smell like humidity. If you want to feel like a chicken in a box, well that's the right place for you. No hot water anywhere and you have to take your hygeinic paper everywhere because there is none in the bathroom. Leaving this place and I'm relieved. The beds are comfortable i guess and the people are nice. At least, it was not expensive...",2023-05-21T18:55:05.704969Z
36,3.0,0.42422494292259216,Garden Hostel,2,"I give him two stars for the backyard and the good attitude of the employees of the place, but they are the worst three nights of my life in a hostel, the notice put a separate room, and as an independent it had nothing, apart from the fact that it looks like a cage for chickens, the walls are made of wood and only 1.80 meters high, and to complete they have rented a group of boys who do not know the word respect, at one in the morning talking on the phone, listening to videos, hitting things, breaking bags made of plastic, eating their soup and other foods with very strong smells in a space designed to sleep, and above all you ask them to please respect and care nothing what you say.  Definitely the worst thing that ever happened to me.",2021-08-12T23:21:10.035467Z
37,2.0,0.7339561581611633,Garden Hostel,4,"Fairly ok for overnight stay, in low price!!  The atmosphere inside feels very good to me!  I think you will like it too!",2023-08-19T01:33:20.314940Z
38,2.0,0.4827335476875305,Garden Hostel,5,"I really enjoyed. The place is quiet, clean and organized. A very good option to young groups.",2023-06-29T14:18:38.835693Z
39,0.0,0.8655051589012146,Pastelaria Pérola,5,"Friendly treatment from the waitresses, everything delicious!",2025-03-31T13:29:15.510177Z
40,0.0,0.6957921385765076,Maré Cheia,5,"Simply fantastic! 🤩🐟🦀
It’s worth visiting Aveiro just for this restaurant. We took a day trip from Porto and decided to eat here spontaneously. Even without a reservation, we got a table for an hour and a half. The stuffed sapateira and the grilled sea bass were simply incredible, and the rice that came with the fish was excellent too, full of mussels and shrimp, perfectly cooked and bursting with flavour.

The service was also extremely friendly, fun, and welcoming, which made the experience even more special. They showed us the fresh catch of the day and asked us our preferences. And to top it off, the price is unbeatable for the quality of the food and service. A truly great experience!",2025-11-12T22:11:44.721549989Z
41,0.0,0.5825210809707642,Maré Cheia,5,"Great place with amazing sea food. I do advise to book for dinner in advance. Preferably go for dinner around 20:00. Service personnel were very accommodating, active in reservation (called us the moment the space freed up for us earlier than original reservation time).",2025-08-16T10:51:48.540796759Z
42,2.0,0.7487933039665222,Maré Cheia,5,"The soup, stir-fried vegetables, and grilled fish were truly memorable. The stir-fried vegetables, in particular, were the best I had in Portugal. The staff were also very friendly and welcoming.",2025-10-24T18:44:59.677569141Z
43,0.0,0.49410414695739746,Maré Cheia,5,"Came in hungry. Left with a happy belly. 😊 got the last table and they are turning people away, so that's lucky.",2025-11-23T13:15:52.671147685Z
44,2.0,0.5408899784088135,Maré Cheia,5,"Amazing meal! The mixed platter for 2 (110€) was plenty for my very hungry family of 4, next time we would also order 4 seafood soups (best in the world, dairy free). Freshly weighed before cooking, I wouldn’t mind heading there from Porto to sit at the bar in the back. Our total was 140€, including wine, a steak, 2 soups, moules. We could barely eat dinner, this meal was so good and plentiful.",2025-07-18T06:43:32.500293654Z
45,0.0,0.675961971282959,Tezero Tripas De Aveiro,5,"I had Tripas de Chocolate Crocante and it was fantastic! Very fluffy and soft, not too sweet, just delicious. Would come back!",2025-08-13T18:03:41.967008959Z
46,2.0,0.8379786014556885,Tezero Tripas De Aveiro,5,The attendant was very friendly. I really enjoyed the food.,2025-11-25T06:31:19.742496697Z
47,2.0,0.8653467893600464,Tezero Tripas De Aveiro,4,"They have combo for tripas, drink and coffee. Great food ambience.",2025-08-27T06:17:13.728585800Z
48,0.0,0.4777454137802124,Tezero Tripas De Aveiro,5,"This is literally the best tripa you will ever eat, it doesn’t compare to any other places you will eat. The Nutella one is a must and I eat every time I go to Aveiro haha. They also have salty options and the decoration is amazing to look while you are waiting or eating.",2023-05-25T19:26:30.612064Z
49,4.0,0.33232277631759644,Tezero Tripas De Aveiro,5,Very delicious tripa and the interior is very beautiful and unique.,2025-06-07T18:29:18.047945Z
50,4.0,0.581157386302948,ROYAL SCHOOL OF LANGUAGES,5,An iconic building that you can easily notice while you are driving or walking. It is located near the river. It is one of language school in Aveiro. The school seems quite big enough. You need to wear a mask before entering the school. They provide some benches to sit in front of the school. There is a beautiful garden too in front of it.,2021-07-01T08:59:53.762556Z
51,1.0,0.48242440819740295,ROYAL SCHOOL OF LANGUAGES,4,"We didn't see the inside, but the facade is quite pretty.",2021-12-14T20:08:26.447483Z
52,4.0,0.7321386337280273,ROYAL SCHOOL OF LANGUAGES,5,Beautiful building does not go unnoticed.,2019-11-02T23:45:35.171143Z
53,2.0,0.9192955493927002,ASIMAMI,4,Food is tasty but seems overpriced for the portions of meat. Service and ambience is good.,2025-10-09T11:09:43.588315698Z
54,2.0,0.555036187171936,ASIMAMI,5,"Amazing infusion of flavours and quite different from the flavours in Australia.  So nice to have access to Asian food after completing the Camino Frances and eating Spanish food. Well done owner of this
business!",2025-10-08T19:02:38.963019969Z
55,2.0,0.6694873571395874,ASIMAMI,5,Excellent restaurant for Asian! Pretty authentic taste and flavour. We really enjoyed our dinner here. Very good service too!,2025-09-03T15:06:07.130644103Z
56,0.0,0.6859261989593506,ASIMAMI,5,Excellent food & service. I've eaten here 3 times on my visit to Aveiro. Highly recommend,2025-09-20T19:25:08.934673982Z
57,0.0,0.7300286889076233,ASIMAMI,5,"A ten-star restaurant!
The food was spectacular. We ordered the Veggie Gua Bao, Pad Thai, and Tahu Goreng Kacang. All the dishes were delicious, but the rice was on another level. We then chose two desserts, Chuoi Chung and Kue Lapis Legit, both very different, which made them even more special.
The decor is tastefully done.
The service was impeccable. Everyone was more friendly and professional than the last.
The bathroom was very clean, which speaks volumes about the restaurant itself.
Perfect, we'll be back!",2025-09-30T16:35:28.002716135Z
58,0.0,0.3989918828010559,Monumento a José Rabumba,3,Nothing out of this world,2022-09-14T20:27:55.199564Z
59,0.0,0.4881146550178528,Turismo Centro de Portugal,5,The fish display on the balcony of tourist center is really nice presentation of Aveiro.,2025-09-16T13:44:07.033257264Z
60,3.0,0.5280234217643738,Turismo Centro de Portugal,4,"Helpful staff,  able to speak in many languages.  Plenty of useful information,  as to be expected  but not sure how much is 'sponsored ' or 'genuinely unbiased '.",2025-09-15T19:39:35.682086471Z
61,3.0,0.4465027451515198,Turismo Centro de Portugal,4,"First of all, take the correct entrance.
When we asked for a map of the city we got one.
Inside the building we could cool down for a moment, which was nice at the moment.",2025-08-05T06:47:04.541942714Z
62,4.0,0.6973881721496582,Turismo Centro de Portugal,5,The building looks so unique and cute b cause of the fish. You can find more information about tourism in the office. It is located near the river. The location is very easy to reach by walking. You can walk and enjoy the view.,2021-06-29T14:26:38.951995Z
63,3.0,0.6820144057273865,Turismo Centro de Portugal,5,This is probably the best service I’ve received in a long time! Wonderful woman behind the desk - made me want to go see stuff I would have never done if it wasn’t for her enthusiasm and level of service ❤️,2025-03-16T15:33:58.540134Z
64,1.0,0.552221417427063,Aveiro City Museum,4,"Housed in a building dating back to 1915, this museum is a participatory space dedicated to preserving and sharing the urban memory of Aveiro. Exhibitions are curated around the experiences and records of local residents, creating a deeply personal and community-focused narrative. Though modest in size, the museum offers thoughtfully curated content with meaningful depth. Above all, the staff are known for their exceptional friendliness and hospitality, enhancing the visitor experience.
※ Included in Aveiro Museum Pass.",2025-06-15T11:36:52.153618Z
65,2.0,0.7126823663711548,Aveiro City Museum,5,Really like the immersion audio experience. The staffs are friendly and pretty cheap to go to know more about the city,2025-06-17T18:41:05.789094696Z
66,3.0,0.5014232993125916,Aveiro City Museum,1,Basic history of Aveiro which would only appeal to those who are really interested. Very little to see here unfortunately. I had allocated an hour but I was in and out in 10 minutes.,2025-10-28T12:06:40.431286971Z
67,4.0,0.6156855225563049,Aveiro City Museum,5,Beautiful looking building that was fully refurbished inside and now serves as the city museum.,2017-08-08T16:59:56.525Z
68,1.0,0.534020185470581,Aveiro City Museum,3,Small museum without so much content. The collection is poor but the explanations are quite ok. A place to go if it’s raining outside and you want to know more about the city.,2025-04-18T14:44:31.118148Z
69,2.0,0.46354755759239197,Pastelaria Rossio,5,"This is the go-to place for trying the traditional Aveiro pastries made with ""ovos moles"".

They have a great variety of products. All made in-house and super fresh.

And, although they look the same, each has its own texture and flavor, which makes it worth trying them all.

You can notice the difference in quality when compared with pre-packed products available in other stores.

And they've been doing this for 56 years now.",2024-10-15T06:37:48.468903Z
70,0.0,0.4049851894378662,Pastelaria Rossio,5,Stopped in here to try ovos moles but ended up buying a whole lot more as everything looked so tasty and it definitely was. We tried 6 different things and each one was very well made. I only wish we could have gone back for more! Well priced given the quality and amount on offer.,2025-09-11T12:44:33.986910752Z
71,2.0,0.49702420830726624,Pastelaria Rossio,5,"we tried the ovos moles here (traditional dessert from Aveiro). I personally didn’t fall in love for it, but the shop is busy, lots of locals buying the pastries and the coffee is good too!",2023-05-21T21:07:35.102457Z
72,2.0,0.7067316174507141,Pastelaria Rossio,5,Had good ovo moles and a cake at this establishment - rather delicious pastries.,2024-08-07T12:41:47.665210Z
73,1.0,0.7315608859062195,Pastelaria Rossio,5,The Best One !,2025-08-17T21:40:05.391114670Z
74,1.0,0.7303728461265564,ALE-HOP Aveiro,5,You should visit when go on a trip here.,2025-09-16T13:20:04.506429685Z
75,3.0,0.7050305604934692,ALE-HOP Aveiro,1,"I received a defective item bought on this store and they denied to replace it without a purchase receipt, even though it was a gift and it was the very next day.
I’ve probably bought over a hundred euros of items there before, so it’s a shame that they lost a customer over a 2€ item",2024-02-07T13:23:13.153195Z
76,2.0,0.5739385485649109,ALE-HOP Aveiro,5,My favorite place . They have so many cute stuff. If you're planning to get a present for someone and you don't know where to go you should go to this place! you will definitely find something,2021-12-27T16:37:02.128857Z
77,2.0,0.8383938074111938,"Talho, Charcutaria, Mercearia e Produtos Regionais, JL",1,"I didn't like the boss, we felt like we were pissing him off, not cool,",2024-08-15T22:03:21.408018Z
78,0.0,0.7302032709121704,"Talho, Charcutaria, Mercearia e Produtos Regionais, JL",5,I highly recommend it.,2021-08-18T05:19:14.438782Z
79,3.0,0.5594600439071655,Memórias da Ria,2,"Boat is ok, the tour is the usual tour.
The quality of the guidance is not really good.
They say “ we will tell you about aveiro”, they just said this is the old part and this is the new part while just putting more and more people on your boat. Didn’t explain or feel like they know or want you to know about the town…",2025-11-21T15:11:22.446413442Z
80,3.0,0.5701417922973633,Memórias da Ria,5,Perfect professional and funny guide in our boat cruise in beautiful Aveiro canals. Price 20.- euro worth it.,2025-05-13T20:06:15.045859Z
81,3.0,0.44613516330718994,Memórias da Ria,4,"Nice walk through the canals of Aveiro where the guide gives you information during the tour in different languages... it's best to do it first thing in the morning... Since as the hours go by, you have to wait longer to get on and more people go by gondola.",2024-08-21T18:05:13.916507Z
82,0.0,0.42497581243515015,Memórias da Ria,5,"An interesting gondola ride through the canals. During the ride, the guide provides many explanations, also in English.",2025-07-10T19:52:58.123773826Z
83,3.0,0.5999698042869568,Primeiro Balcão,1,Out of business 😔,2024-07-18T23:45:25.606604Z
84,2.0,0.5821019411087036,Primeiro Balcão,5,A boat ride and buying salt at the salt mine are essential.,2023-08-03T22:02:00.573876Z
85,4.0,0.5973052978515625,Primeiro Balcão,1,He is no longer there.,2023-07-10T12:12:59.100971Z
86,0.0,0.9088276028633118,CASA MARQUES,5,I got a few things here most of the prices are the same but the lady was so nice so I was happy with the gifts that I got,2025-07-01T20:54:14.397847168Z
87,3.0,0.532772958278656,CASA MARQUES,5,"Beautiful souvenirs, made in Portugal, not in China 😁
The lady in the shop is very friendly, helpful, and patient.
It's a shame there's no online shop, because I'd love to reorder the beautiful socks from Meia Mania.
Bought: bags with azulejos motifs, various socks, and a knitted poncho.",2021-06-26T13:14:58.266704Z
88,3.0,0.9103904962539673,CASA MARQUES,1,"I paid 20 euros, but the man kept insisting that I only paid 10! After protesting for a while, I finally got my change.",2024-10-20T11:02:44.366227Z
89,3.0,0.8991746306419373,DOURO ACIMA AVEIRO,1,Poor guides. Never engaged with our side of the boat once. Would not recommend at all,2025-04-23T11:52:16.841104Z
