row_idx,topic_id,topic_prob,place_name,rating,review_text,publish_time
1276,2.0,0.46541643142700195,Café Palácio,5,"The place is run by amazing people.
The food is good and affordable.

Nice atmosphere.

Not a fancy place if that’s what you are looking for, but one of the best places for me",2025-08-22T17:22:50.818559873Z
1277,0.0,0.37875649333000183,Café Palácio,4,"Really enjoyed the alheira, yummy. Due to miscommunication, had a chance to try alcohol free stout. 1/2D means a smaller portion good for one pax.",2023-05-30T16:12:30.515260Z
1278,0.0,0.7070454955101013,Café Palácio,5,"We had the lombinhos con amêijoas and the bacalhau à Brás and both were delicious. The place is away from the crowds in a quiet street. The service was amazing, super attentive and fast. Well Priced. Would definitely come again. Muito obrigada",2019-06-01T14:10:41.602935Z
1279,0.0,0.4052973687648773,Café Palácio,5,"Got to love that 'bacalhau com natas' (codfish w/ milk cream). Still the best around. Very nice people in there. Home kitchen, that's it, feels like it. Today I was introduced to the 'cova'. Can't say more, it's kind of secret and not for everyone. 😜",2019-03-08T21:07:36.077180Z
1280,2.0,0.6205353736877441,Café Palácio,5,Traditional Portuguese cafe and restaurant Well cooked and very tasty traditional food at a very reasonable price Very friendly staff These places are sadly slowly disappearing in a town overtaken by profit oriented franchises serving fakery at ridiculous prices Well kept secret n Aveiro!,2023-04-07T21:29:28.503482Z
1281,3.0,0.6034351587295532,Pedro Nunes Ferreira,5,The best lawyer in town! Thank you for winning this case Pedro!,2025-08-03T12:15:15.013822394Z
1282,0.0,0.7295750379562378,Pedro Nunes Ferreira,1,Absolutely do not recommend!,2023-12-12T19:17:34.698531Z
1283,3.0,0.7944083213806152,Experimentaveiro,5,"I had a great time, very real.",2020-08-25T09:06:01.144956Z
1284,4.0,0.7457482218742371,Casa Peixinha,5,"If you plan to visit Aveiro, the Portuguese Venice, you can stay in this little house, a 1-minute walk from the canal. It's perfect, charming, and completely renovated. Excellent service from the owner.",2025-10-18T05:16:39.480140199Z
1285,4.0,0.6326584815979004,Casa Peixinha,5,"We stayed for a whole weekend; we're a couple with two children. The house is exceptional, with everything you need, the location is central, and the owner was fantastic. I would recommend this place to anyone.",2025-04-07T13:35:56.336858Z
1286,3.0,0.6056957840919495,Mortgage and Real Estate Agency,5,"I first saw Rafael's Interview in Youtube Expats Everywhere Channel a year ago. We were looking to buy a property in Madeira last year which was a new construction project. We are US Citizens based in Chicago and love Madeira Island.

The interview impressed me and I reached out to Rafael and he setup an initial Zoom Call and explained the entire Mortgage Process to me, for US expats moving to Portugal and planning to buy property.

I submitted all the documents needed for Mortgage via a Shared Google Drive and Rafael and his team got working on it immediately. They helped me with finding a good Mixed Rate with multiple banks. They also helped me open a Bank Account at NovoBanco using a Lawyer, all done remotely.

We finally closed the Public Deed on time and I travelled to Madeira for the Deed and we got the Keys to the property in Feb 2024.

Rafael and his team (Frederico Franca) provided exceptional service and made the process totally smooth. They reached out to my builder to get all the documents needed for the Deed and liaised with the NovoBanco Bank Manager on my behalf to make sure everything gets done on time and there are no hiccups during the Public Deed Closing.

If you are planning to buy property in Portugal, please go with Rafael and his team for your Mortgage Needs. They are the most professional and the best team out there helping US and EU expats buy property in Portugal and get a Mortgage.

I give them 10/10 for their professional, communication, ethical and a very knowledgeable team. Highly recommended. Thanks Rafael and Fred for making the Home buying and Mortgage FInancing  process extremely smooth for me.",2024-02-23T18:27:25.380800Z
1287,3.0,0.43276891112327576,Mortgage and Real Estate Agency,5,"Purchasing our dream home felt like an impossible task until we met Rafael and his incredible team, Fred and Emilia. From start to finish, their expertise, dedication, and professionalism made all the difference. Rafael’s deep knowledge of the mortgage process and Fred’s invaluable guidance turned what seemed like an overwhelming journey into a smooth and achievable goal.

Emilia, our lawyer, demonstrated exceptional professionalism and skill, seamlessly navigating the legal complexities and ensuring everything was handled with precision.

Their communication was excellent throughout, keeping us informed at every step. Their genuine care and willingness to go above and beyond truly set them apart.

Thanks to Rafael and his team, we successfully purchased our dream home in a beautiful location, and we couldn’t be more grateful. Their advice and support made all the difference, and we will forever be thankful for their hard work and dedication. Our kids will grow up appreciating the wonderful environment and, most importantly, the warmth of a true family home. Thank you all from the bottom of our hearts.

If you’re considering buying property in Portugal, especially if you’re navigating a complex process like obtaining a mortgage or dealing with legal matters, we wholeheartedly recommend Rafael, Fred, and Emilia. They’re the team you can trust to make your dreams a reality!",2025-01-26T19:52:40.242542Z
1288,3.0,0.4740420877933502,Mortgage and Real Estate Agency,5,"The team assembled by Rafael was consciously aware of providing us with the best care, attention, and options needed to buy a new home. It was a very high level of professionalism that always made us feel at ease, removing anxiety or any concerns during the process. They took us each step of the way, making sure we understood the where and why for everything that was being done. They never gave us the impression of alarm or pressure, and were prompt in their responses to our questions. Very Highly Recommended.",2025-03-31T17:35:23.666742Z
1289,0.0,0.4704861640930176,Mortgage and Real Estate Agency,5,Awesome experience during a hectic time moving. Extremely great service and seamless. Will continue to use in the future.,2025-10-25T10:29:21.344106893Z
1290,0.0,0.40218842029571533,Mortgage and Real Estate Agency,5,"Working with Rafael and his team was amazing. They were extremely organized and communicated with us at every turn. Buying a house in a foreign country is very daunting and has plenty of twists and turns, but Id never do it again without Rafael and his team. Thank you all very much!",2023-12-22T14:47:54.876087Z
1291,0.0,0.5866205096244812,Restaurante Japonês - HARU SUSHI,4,"This review is based on several times that I came here. The service here is ""all you can eat."" Personally, I prefer this type of service because the food is prepared upon the order. The food is great, especially the spicy shrimp! The atmosphere is quite nice. However, the service this time was a bit slow, even though they were almost full. I made a reservation, which I recommend, at 13h, and we finished lunch almost at 14h30. This was in a weekday! Apart from that, it was always a great experience and the price is good.",2024-09-04T12:31:56.278684Z
1292,0.0,0.3970639705657959,Restaurante Japonês - HARU SUSHI,5,"Reservation recommended on the weekends. The kitchen closes at 14:30. Large menu and everything was prepared well.

We had to wait a little for our food because the place was full but it was worth the wait. I liked the variety and they don't sacrifice the quality. Everything tasted good.

One of the better sushi restaurants I visited.",2023-06-23T12:34:52.461593Z
1293,3.0,0.3215954005718231,Restaurante Japonês - HARU SUSHI,3,"Used to be good, but the service got progressively worse (i used to come here once a month) not every server is rude, but 2 of them are especially unpleasant, made me stop going as often. Then food as been worsening with time too, loss of quality in some cases, in other cases just plain lack of care. If you want to go eat at a place where you feel like you're a bother, and want to wait close to an hour for your food, this is the place!  The food was it's redeeming quality, but now even that is gone!",2025-07-18T12:22:53.530321563Z
1294,0.0,0.6162069439888,Restaurante Japonês - HARU SUSHI,5,"We had a great experience, sure we’ll be back. Just make sure to have a reservation and don’t visit the place 1 hour before it’s closed, you won’t be able to order more if you are still hungry",2024-11-10T15:51:47.255288Z
1295,2.0,0.7283847332000732,Restaurante Japonês - HARU SUSHI,5,"You can find very different types of sushi and not only. All you can eat, but it's not a buffet type, you ask positions from menu, as many as you want. Super tasty and fresh",2025-07-04T20:02:11.666938835Z
1296,0.0,0.7379403114318848,Lina - D.G. Atelier,5,"Excellent professional, good service, and pleasant atmosphere, impeccable work in my case I recommend the waxing 👍",2018-01-08T21:36:53.658Z
1297,4.0,0.690177857875824,Parque infantil da Forca,5,Great area for a nice walk and lots of fresh air.,2022-01-19T13:27:45.264300Z
1298,2.0,0.6217029094696045,Luxor Lounge Bar Shisha,5,"Cozy place, went there with my bf for some drinks . I also liked the Egyptian theme",2022-05-04T01:50:06.860941Z
1299,2.0,0.8367373943328857,Luxor Lounge Bar Shisha,5,A very nice place with amazing drinks and shots,2021-05-04T21:32:49.079963Z
1300,0.0,0.5255036354064941,Luxor Lounge Bar Shisha,5,Very nice decoration and atmosphere.,2025-06-08T12:30:21.497605Z
1301,2.0,0.7657780647277832,Luxor Lounge Bar Shisha,5,"Great shisha bar owned by two sisters: one specializes in drinks and the other in shisha.
Cool ambiance and decoration.
They have natural charcoal if you ask for it. A excellent option for a good time and shisha at the end of the day.",2019-09-25T20:58:58.225524Z
1302,3.0,0.5409048795700073,Luxor Lounge Bar Shisha,5,Amazing place and service! Pay attention on working hours and if planned to smoke shisha it is better to leave a reservation.,2019-05-11T12:59:01.344666Z
1303,1.0,0.33360373973846436,Raposa Branca by Anna Khadikova,5,"Anna is an amazing manicure, every time I come to Portugal I do my nails with her. Her place is very clean, she’s very detailed and her work is amazing as I said.",2025-09-19T07:41:43.531355555Z
1304,0.0,0.6595426201820374,Raposa Branca by Anna Khadikova,5,"The manicure lasts perfectly, the nails look well-groomed and beautiful for a long time.

In addition, the atmosphere during the procedures is always pleasant - you can relax, chat and just enjoy the process. I really appreciate her attention to detail and individual approach. I definitely recommend her to everyone who is looking for a master who you want to return to again and again!",2025-02-27T20:51:06.193452Z
1305,2.0,0.6288952827453613,Pastelaria Liceu,5,"This place is absolutely amazing and local. Stumbled upon this place as a tourist and the prices were cheap. €1 for cappuccino (which is the best cappuccino I have ever tasted), €1.40 for sausage roll and €2.50 for steak on burger! Absolutely delicious!!!",2022-07-26T15:07:34.682493Z
1306,2.0,0.5159366130828857,Pastelaria Liceu,5,Been here for toast and coffee several times and have been served quickly and with a smile.  Toast is thick and very good.,2022-03-24T10:18:37.103926Z
1307,2.0,0.4223391115665436,Pastelaria Liceu,2,Without a lot of pastry ( maybe because the school haven't start) but  opens early on Sunday.,2022-09-12T16:04:15.901208Z
1308,2.0,0.5483310222625732,Pastelaria Liceu,5,"Delicious coffee with rice cake, attentive and friendly staff.
I highly recommend it.",2024-12-31T10:38:00.667118Z
1309,1.0,0.6703844666481018,Pastelaria Liceu,5,The best cakes I've ever tried and still an incredible price.,2025-08-31T12:56:59.617853698Z
1310,1.0,0.5772110223770142,Chapel of St. Euphemia,5,"Beautiful, small, and steeped in history. There are many chapels in Aveiro. They're good historical sites to visit. A few steps further behind it is a mini chapel of St. Anthony.",2024-09-05T16:48:04.278260Z
1311,1.0,0.6238266825675964,Dream.Aveiro Beauty Studio - Cabeleireiro Aveiro,5,"It is an amazing place with an even better cost / benefit. I love getting my nails done there, great atmosphere and everyone is always very nice! They also have the best cookie ever",2024-12-18T11:42:41.779577Z
1312,0.0,0.7968111038208008,Dream.Aveiro Beauty Studio - Cabeleireiro Aveiro,5,Happy first anniversary girls!,2025-02-01T15:37:24.979953Z
1313,0.0,0.515510618686676,Confeitaria Mirador,5,This is our go to cafe when we are around the area. Absolutely love their coffee and food. The owners are lovely and speaking my language. Loving it.,2025-08-13T11:54:59.359270361Z
1314,2.0,0.8636895418167114,Confeitaria Mirador,5,"Friendly staff, excellent pastry and breads.",2022-07-22T15:37:35.116108Z
1315,2.0,0.5352721810340881,Confeitaria Mirador,5,Excellent breads and coffees and lovely owners.,2021-05-26T20:38:28.551261Z
1316,0.0,0.4920036494731903,Stúdio Ju Nogueira,5,Excellent profissional realy enjoy the experience just one word 5🌟🥰,2025-02-25T15:41:45.623953Z
1317,3.0,0.5995446443557739,Serviço de Finanças Aveiro 1 (Autoridade Tributária e Aduaneira),1,Its closed,2022-01-28T15:21:11.387989Z
1318,2.0,0.5771375298500061,Farmácia Ala,5,Good service and plenty of parking spots around.,2020-12-30T16:52:20.050436Z
1319,3.0,0.4876694679260254,Repartição de Finanças de Aveiro-1ª,5,Help quickly resolve issue with financas portal,2025-10-15T10:49:51.680512073Z
1320,3.0,0.40483027696609497,Repartição de Finanças de Aveiro-1ª,4,very Help full,2024-12-30T07:41:05.732685Z
1321,1.0,0.5984662175178528,Luxus Hairstylist,5,The best,2023-12-13T22:14:23.763556Z
1322,4.0,0.3708704710006714,Newimo Realtors,5,"Appreciate the experience working with REA João Silva. He arranged all the appointments fast, always available for our requests and helpful to make our life easy in our cozy apartments. They also assist with utility contracts before entering the apartments. And don’t worry about your portuguese proficiency, they’ll support you in English.",2025-10-06T17:08:46.685991394Z
1323,0.0,0.9256792068481445,Newimo Realtors,5,"I rented a flat through João, and the whole process was smooth and quick. Everything was handled professionally, and I’m very happy with the service. Highly recommend!",2025-08-26T08:59:22.603401724Z
1324,0.0,0.8044247031211853,Newimo Realtors,5,"Great attentive and professional service.
The people at Newimo are very responsive and good at problem solving.
Highly recommended.",2024-12-12T17:44:52.956519Z
1325,4.0,0.864677906036377,Newimo Realtors,4,João Silva represents the owner of the apartment we rent. He has been responsive and helpful when we have needed to deal with him.,2024-03-23T15:27:27.118805Z
1326,0.0,0.8654087781906128,Newimo Realtors,5,"Trustworthy people
Fast responding and have alot of experience in the field.
Highly recommended",2024-03-20T15:49:20.207976Z
1327,1.0,0.5998978614807129,PRIO Energy SA,5,Top!,2018-03-20T08:10:27.494Z
1328,4.0,0.40909305214881897,sitio aveiro - cowork,5,"Nice coworking with meeting rooms, fixed (and not) desks, kitchen zone. Friendly staff, easy to book (call or email)",2025-09-03T21:04:06.869929318Z
1329,3.0,0.6832485198974609,sitio aveiro - cowork,1,Not reachable and no one on site. Even though the opening hours say otherwise.,2024-04-26T09:06:10.638235Z
1330,4.0,0.7330535054206848,sitio aveiro - cowork,5,Free coffe 10/10,2024-07-23T17:17:06.681704Z
1331,3.0,0.7515885233879089,Espaço P,5,"I had the pleasure in having Jose Lopes at Espaco P helping me strengthen my lower back muscles something that as been an issue for me for over 35 years.
He was always professional,  listens to my issues and created some exercises to fit my needs and helped me manage my lower back pain.",2022-01-24T13:48:24.634069Z
1332,1.0,0.5998982787132263,"Neosprint, lda",5,Top,2023-04-04T18:22:05.852242Z
1333,3.0,0.6038876175880432,NBIZ Business & Consulting,5,"Running a small business always comes with unexpected challenges, but without a doubt, the best business decision i have made since relocating to Portugal has been to contract the services of NBIZ. Their team of experts has not only been patient and supportive, but their knowledge of Portuguese business law is beyond compare, and I have confidence that my financials will be taken care of every step of the way.

Whether my new business succeeds or fails is ultimately up to me, but with NBIZ I not only feel like I am working with the best talent available, but I have the absolute trust of working with family!

Make a great decision of your own and connect with NBIZ Consultores today!",2025-10-30T08:27:28.862640884Z
1334,3.0,0.824592649936676,NBIZ Business & Consulting,5,"Very professional, knowledgeable and responsive.  We had all our questions answered in detail plus many useful suggestions and advices. We will definitely work with Dr. Mario and Catarina again and we highly recommend them.",2025-09-24T20:18:12.560781811Z
1335,3.0,0.9372843503952026,NBIZ Business & Consulting,5,"Being a new person in Portugal I made a lot of mistakes in my first IRS. But, thanks to the help of Dr Eloi Moita, I was able to completely correct the situation.",2024-03-05T13:35:05.052279Z
1336,0.0,0.7956609129905701,NBIZ Business & Consulting,5,"AMAZING!
the best team!",2024-09-20T17:07:33.179227Z
1337,3.0,0.7065746784210205,Exxa Design,5,"Excellent collaboration and unbeatable creativity. Although they don't have a very high international profile, they are real gems. Thank God we discovered them before they explode.",2025-10-22T09:37:10.651605124Z
1338,1.0,0.553090512752533,Papelaria Cláudia,1,"Terrible terrible experience. I cannot understand why would someone have a shop and hate people and be rude to them for free. If you do not want to receive Vinted packaged, do not make deals with them... People can be unhappy with life, but that does not give them the right to treat others badly",2025-06-26T09:03:42.095135500Z
1339,1.0,0.41479215025901794,Papelaria Cláudia,1,My advice is to stay as far from this store as possible. I only go there because I am forced to pick up parcels that are transferred by DPD.,2025-10-15T07:24:50.251837921Z
1340,3.0,0.7587225437164307,Papelaria Cláudia,1,"I left a package to be returned and it disappeared. I went to the store to talk to them and they said they'd call me back with a possible solution, but nothing! In the end, I got neither a refund nor my package back.",2025-12-03T15:47:08.704554677Z
1341,3.0,0.46308594942092896,Clínica de Dermatologia Médico-Cirúrgica Dr. Sereijo Silva,1,"This doctor needs to retire. He does not care about the mental well being of his patients and has zero bedside manner.  Bedside manner =  doctor's approach or attitude to a patient.   He doesn't receive the biopsy results but has you call to read them to him over the phone, except he didn't even allow me to read the complete result. When I asked questions to understand these results better,  he just continued to say don't worry about it and have nice holidays.   When I saw another dermatologist for a second  opinion , they said what Dr sereijo told me about my results was wrong.

There is a reason you can make an appointment a few days after calling the clinic, because he is a terrible doctor and professional.   Any other good dermatologist,  you need to wait several weeks or even months to be seen.  Avoid this guy at all costs. He is not up to date on current medical practices.",2024-09-07T20:51:48.738704Z
1342,1.0,0.4957168400287628,Clínica de Dermatologia Médico-Cirúrgica Dr. Sereijo Silva,5,"Dr. Sereijo has been following me for more than 10 years, solving all the skin complications I had throughout that time. His knowledge and experience is invaluable, always with the right treatments and products. Thank you for everything. Hope I don’t need to visit but if I do I know I’ll be in safe hands.",2023-06-15T17:50:06.656669Z
1343,3.0,0.4027223289012909,Clínica de Dermatologia Médico-Cirúrgica Dr. Sereijo Silva,5,"Very good medical appointments.
Both the doctor and the secretary always deal with matters in the best way.
Many congratulations for the good work.",2022-10-29T10:35:49.867620Z
1344,2.0,0.40720513463020325,Espaço Pêlo,5,"Amazing results with this laser, at a good price.",2024-01-05T15:42:04.492307Z
1345,4.0,0.6106824278831482,Espaço Pêlo,5,Friendly and safe environment. Conveniently located.,2022-08-02T09:59:22.171449Z
1346,2.0,0.7289247512817383,Prabitar,5,Very good service.,2019-08-06T00:11:51.695363Z
1347,2.0,0.7293343544006348,Tintas Robbialac,5,"The material are affordable and with quality. But what really stands out it's the quality of service. They have an excelent advice service, in which a client is invited to a Q&A period in order to properly identify the problem so that a material and a technique can be properly fitted. A mandatory stop for DIY lovers and those who find themselves in trouble and need solutions. And there is always a discount waiting for.",2022-01-18T12:41:24.633282Z
1348,0.0,0.32732969522476196,Tintas Robbialac,5,"A very good display of the full @Robbialac line, but the most important thing is the advice from the salesperson. They provide you with extensive experience on what to buy based on what you want to do with the paint. 100% recommended.",2023-06-13T13:16:03.986955Z
1349,2.0,0.4712752401828766,"Taberna ""Caçola""",5,"I love this place.
Its a hidden Gem.
If you are reading this and your a tourist, you need to go here.
You want get more typical home made food than in someones home.
Actually its in their garage..
A must visit, Always busy.",2016-06-09T16:05:09.409Z
1350,2.0,0.9174612164497375,"Taberna ""Caçola""",5,Good food & service at very reasonable prices. Love the cozy interior. Recommend!,2023-11-11T11:02:32.665285Z
1351,2.0,0.703367292881012,"Taberna ""Caçola""",5,"A very traditional Portuguese kitchen, good food made like at home. Restaurant is located in the inner garden of traditional Portuguese house.",2020-03-10T10:16:05.845056Z
1352,2.0,0.8657472133636475,"Taberna ""Caçola""",4,Not a fancy place but the grilled fish and meat are very nice.,2021-11-09T09:36:45.586845Z
1353,1.0,0.7969499826431274,"Taberna ""Caçola""",5,Best place in Aveiro!,2023-03-03T22:48:25.625385Z
1354,0.0,0.641631007194519,Mãos Sábias Retrosaria,5,"What a little treasure!! Super helpful staff, Suzanna especially. Gorgeous quilting fabrics and such a selection for my project. Definitely coming back even if it is a 90 min drive from my house.",2025-10-17T15:42:09.588895182Z
1355,2.0,0.4333575665950775,Mãos Sábias Retrosaria,5,"Lots of variety in fabrics and threads, the best qualities on the market! I also love the way they treat us every time we need something. Always very friendly, 10 out of 10 🥰",2024-10-17T13:15:51.345376Z
1356,2.0,0.7962357401847839,Padaria Fanepão 88,5,"A bakery with a wide selection of products - you'll get Portuguese specials like pasteis, or brioche croissants but also red velvet or kinder bueno muffins, tortilla wraps, or milenesa sandwiches. Everything at fair prices. The service is quick and friendly.",2025-01-22T13:12:01.626338Z
1357,2.0,0.5476632118225098,Padaria Fanepão 88,5,"Very tasty, fairly priced, nice atmosphere, great coffee and lovely people.",2024-04-18T08:55:15.549026Z
1358,0.0,0.8650703430175781,Padaria Fanepão 88,5,"Very very good food and kind staff, very recommended",2021-08-25T09:29:11.481742Z
1359,1.0,0.375947505235672,Padaria Fanepão 88,5,Wonderful bakery and coffee shop. The staff are super friendly as are the many students using the cafe. We had lots of offers for help in English also recommendations on what to choose. AMAZING.,2022-09-20T07:40:17.801334Z
1360,2.0,0.6600741147994995,Padaria Fanepão 88,5,The best padaria and caffee bar. The staff is very nice.,2022-07-05T20:25:09.312736Z
1361,0.0,0.8826197981834412,Video Norte - Centros de Cópias,5,Good service and girls working there are very nice and professional.,2021-06-05T20:37:13.672132Z
1362,1.0,0.5998980402946472,Video Norte - Centros de Cópias,5,Top,2019-11-10T08:12:57.597988Z
1363,2.0,0.44616806507110596,Vegifrut,5,"I got a sandwich with seafood paste, sweet corn, cherry tomatoes and lettuce. It was very very tasty and fresh. The soup was great too. You could taste the freshness of the ingredients in it, as well. The music was not that good though and the cool bright white light made the ambiance less warm. It would be great if warm white lights are used. Nevertheless, the place is super clean and the staff was welcoming and very very helpful. It was my first time and they let me try some of the pastes to decide.",2021-10-07T19:19:34.689079Z
1364,2.0,0.6017343997955322,Vegifrut,5,"I found rhis place on my random stroll throgh town, and was looking for somerhing fresh and healy. I asked for the servers favoriete sandwich and got a very tasty one. It was also a lot of food for me :).",2024-06-29T13:00:25.689738Z
1365,0.0,0.7357425689697266,Vegifrut,5,"We absolutely loved this gem of a restaurant; calm away from the tourists, the owner spoke English and was very attentive to our children. Excellent quality salads and juices. Highly recommend this restaurant!",2024-08-09T16:21:46.671525Z
